{
  "applicability": {
    "capabilities": ["framework.react-driver"]
  },
  "checks": [
    {
      "assertions": [
        {
          "equals": 2,
          "field": "$.hooks.beforeIteration",
          "kind": "resultField"
        }
      ],
      "checkId": "react-driver-ext.before-iteration-twice",
      "input": {
        "scenarioPath": "$.driver-hook-turn"
      },
      "operation": "driver.execute",
      "scenario": "driver-api-scenarios",
      "evidence": ["result.hooks.beforeIteration"]
    },
    {
      "assertions": [
        {
          "equals": 2,
          "field": "$.hooks.aroundModel",
          "kind": "resultField"
        }
      ],
      "checkId": "react-driver-ext.around-model-twice",
      "input": {
        "scenarioPath": "$.driver-hook-turn"
      },
      "operation": "driver.execute",
      "scenario": "driver-api-scenarios",
      "evidence": ["result.hooks.aroundModel"]
    },
    {
      "assertions": [
        {
          "equals": 2,
          "field": "$.hooks.afterIteration",
          "kind": "resultField"
        }
      ],
      "checkId": "react-driver-ext.after-iteration-twice",
      "input": {
        "scenarioPath": "$.driver-hook-turn"
      },
      "operation": "driver.execute",
      "scenario": "driver-api-scenarios",
      "evidence": ["result.hooks.afterIteration"]
    },
    {
      "assertions": [
        {
          "equals": 1,
          "field": "$.hooks.aroundTool",
          "kind": "resultField"
        }
      ],
      "checkId": "react-driver-ext.around-tool-once",
      "input": {
        "scenarioPath": "$.driver-hook-turn"
      },
      "operation": "driver.execute",
      "scenario": "driver-api-scenarios",
      "evidence": ["result.hooks.aroundTool"]
    },
    {
      "assertions": [
        {
          "equals": [
            "beforeIteration",
            "aroundModel.before",
            "aroundModel.after",
            "aroundTool.before",
            "aroundTool.after",
            "afterIteration",
            "beforeIteration",
            "aroundModel.before",
            "aroundModel.after",
            "afterIteration"
          ],
          "field": "$.hooks.phaseTrace",
          "kind": "resultField"
        }
      ],
      "checkId": "react-driver-af.extension.phase-order-before-around-after",
      "input": {
        "scenarioPath": "$.driver-hook-turn"
      },
      "operation": "driver.execute",
      "scenario": "driver-api-scenarios",
      "evidence": ["hooks.phaseTrace"]
    },
    {
      "assertions": [
        {
          "equals": ["aroundTool.before", "tool.execute", "aroundTool.after"],
          "field": "$.hooks.aroundToolTrace",
          "kind": "resultField"
        }
      ],
      "checkId": "react-driver-af.extension.around-tool-nesting",
      "input": {
        "scenarioPath": "$.driver-hook-turn"
      },
      "operation": "driver.execute",
      "scenario": "driver-api-scenarios",
      "evidence": ["hooks.aroundToolTrace"]
    },
    {
      "assertions": [
        {
          "equals": true,
          "field": "$.hooks.terminalMutationAttempted",
          "kind": "resultField"
        },
        {
          "equals": "driver hook turn completed",
          "field": "$.hooks.terminalMutationDurableText",
          "kind": "resultField"
        }
      ],
      "checkId": "react-driver-af.extension.after-iteration-terminal-state-nondurable",
      "input": {
        "scenarioPath": "$.driver-hook-turn"
      },
      "operation": "driver.execute",
      "scenario": "driver-api-scenarios",
      "evidence": [
        "hooks.terminalMutationAttempted",
        "hooks.terminalMutationDurableText"
      ]
    },
    {
      "assertions": [
        {
          "equals": "modified",
          "field": "$.aroundModel.finalAssistantText",
          "kind": "resultField"
        },
        {
          "equals": 1,
          "field": "$.aroundModel.messageStartCount",
          "kind": "resultField"
        },
        {
          "equals": ["provider"],
          "field": "$.aroundModel.streamedTextDone",
          "kind": "resultField"
        }
      ],
      "checkId": "react-driver-af.around-model-post-stream-replacement",
      "input": {
        "scenarioPath": "$.driver-around-model-post-stream-replacement"
      },
      "operation": "driver.execute",
      "scenario": "driver-api-scenarios",
      "evidence": [
        "aroundModel.finalAssistantText",
        "aroundModel.messageStartCount",
        "aroundModel.streamedTextDone"
      ]
    },
    {
      "assertions": [
        {
          "equals": "second attempt",
          "field": "$.aroundModel.finalAssistantText",
          "kind": "resultField"
        },
        {
          "equals": 2,
          "field": "$.provider.generate.callCount",
          "kind": "resultField"
        }
      ],
      "checkId": "react-driver-af.around-model-retry-final-response-durable",
      "input": {
        "scenarioPath": "$.driver-around-model-retry-final-response"
      },
      "operation": "driver.execute",
      "scenario": "driver-api-scenarios",
      "evidence": [
        "aroundModel.finalAssistantText",
        "provider.generate.callCount"
      ]
    },
    {
      "assertions": [
        {
          "field": "$.hooks.beforeIteration",
          "kind": "resultField"
        }
      ],
      "checkId": "react-driver-ext.hook-field-present.before-iteration-present",
      "input": {
        "scenarioPath": "$.driver-hook-turn"
      },
      "operation": "driver.execute",
      "scenario": "driver-api-scenarios",
      "evidence": ["result.hooks.beforeIteration"]
    },
    {
      "assertions": [
        {
          "field": "$.hooks.afterIteration",
          "kind": "resultField"
        }
      ],
      "checkId": "react-driver-ext.hook-field-present.after-iteration-present",
      "input": {
        "scenarioPath": "$.driver-hook-turn"
      },
      "operation": "driver.execute",
      "scenario": "driver-api-scenarios",
      "evidence": ["result.hooks.afterIteration"]
    },
    {
      "assertions": [
        {
          "field": "$.hooks.aroundModel",
          "kind": "resultField"
        }
      ],
      "checkId": "react-driver-ext.hook-field-present.around-model-present",
      "input": {
        "scenarioPath": "$.driver-hook-turn"
      },
      "operation": "driver.execute",
      "scenario": "driver-api-scenarios",
      "evidence": ["result.hooks.aroundModel"]
    },
    {
      "assertions": [
        {
          "field": "$.hooks.aroundTool",
          "kind": "resultField"
        }
      ],
      "checkId": "react-driver-ext.hook-field-present.around-tool-present",
      "input": {
        "scenarioPath": "$.driver-hook-turn"
      },
      "operation": "driver.execute",
      "scenario": "driver-api-scenarios",
      "evidence": ["result.hooks.aroundTool"]
    },
    {
      "assertions": [
        {
          "equals": 4,
          "field": "$.trace.checkpoint.evidence.checkpoint.manifestPathCount",
          "kind": "stateField"
        }
      ],
      "checkId": "react-driver-ext.checkpoint-manifest-path-count",
      "evidence": ["trace.checkpoint.evidence.checkpoint.manifestPathCount"],
      "input": {
        "scenarioPath": "$.driver-checkpoint-turn"
      },
      "operation": "driver.checkpoint",
      "scenario": "driver-api-scenarios",
      "steps": [
        {
          "input": {
            "scenarioPath": "$.driver-checkpoint-turn"
          },
          "operation": "driver.checkpoint",
          "stepId": "checkpoint"
        }
      ]
    }
  ],
  "packetId": "tuvren.framework.react-driver",
  "planId": "tuvren.framework.react-driver.extended",
  "planVersion": "0.1.0",
  "scenarios": {
    "driver-api-scenarios": "../scenarios/driver-api-scenarios.json"
  }
}
