{
  "applicability": {
    "capabilities": ["framework.driver-api"]
  },
  "checks": [
    {
      "assertions": [
        {
          "equals": "completed",
          "field": "$.driver.phase",
          "kind": "resultField"
        }
      ],
      "checkId": "driver-api-ext.execute.hook-turn-phase-completed",
      "input": {
        "scenarioPath": "$.driver-hook-turn"
      },
      "operation": "driver.execute",
      "scenario": "driver-api-scenarios",
      "evidence": ["result.driver.phase"]
    },
    {
      "assertions": [
        {
          "field": "$.driver.phase",
          "kind": "resultField",
          "matches": "^(running|paused|completed|failed)$"
        }
      ],
      "checkId": "driver-api-ext.execute.hook-turn-phase-string",
      "input": {
        "scenarioPath": "$.driver-hook-turn"
      },
      "operation": "driver.execute",
      "scenario": "driver-api-scenarios",
      "evidence": ["result.driver.phase"]
    },
    {
      "assertions": [
        {
          "kind": "errorEnvelope",
          "path": "$.result.error"
        }
      ],
      "checkId": "driver-api-ext.execute.provider-failure-error-envelope",
      "evidence": ["result.error.code"],
      "input": {
        "scenarioPath": "$.driver-provider-failure"
      },
      "operation": "driver.execute",
      "scenario": "driver-api-scenarios"
    },
    {
      "assertions": [
        {
          "equals": "fail",
          "field": "$.driver.resolutionType",
          "kind": "resultField"
        },
        {
          "equals": "invalid_loop_policy",
          "field": "$.driver.errorCode",
          "kind": "resultField"
        },
        {
          "kind": "errorEnvelope",
          "path": "$.result.error"
        }
      ],
      "checkId": "driver-api-af.invalid-loop-policy-tool-call-hard-fail",
      "input": {
        "scenarioPath": "$.driver-invalid-loop-policy-tool-call"
      },
      "operation": "driver.execute",
      "scenario": "driver-api-scenarios",
      "evidence": ["driver.resolutionType", "result.error.code"]
    },
    {
      "assertions": [
        {
          "equals": "end_turn",
          "field": "$.driver.resolutionType",
          "kind": "resultField"
        }
      ],
      "checkId": "driver-api-ext.resume.approval-resolution-end-turn",
      "input": {
        "scenarioPath": "$.driver-resume-approval"
      },
      "operation": "driver.resume",
      "scenario": "driver-api-scenarios",
      "evidence": ["result.driver.resolutionType"]
    },
    {
      "assertions": [
        {
          "contains": "call-search",
          "field": "$.driver.pendingToolCallIds",
          "kind": "resultField"
        }
      ],
      "checkId": "driver-api-ext.resume.approval-pending-call-id-list-non-empty",
      "input": {
        "scenarioPath": "$.driver-resume-approval"
      },
      "operation": "driver.resume",
      "scenario": "driver-api-scenarios",
      "evidence": ["result.driver.pendingToolCallIds"]
    },
    {
      "assertions": [
        {
          "contains": "call-search",
          "field": "$.driver.approvalDecisionCallIds",
          "kind": "resultField"
        }
      ],
      "checkId": "driver-api-ext.resume.approval-decision-call-id-includes-call-search",
      "input": {
        "scenarioPath": "$.driver-resume-approval"
      },
      "operation": "driver.resume",
      "scenario": "driver-api-scenarios",
      "evidence": ["result.driver.approvalDecisionCallIds"]
    },
    {
      "assertions": [
        {
          "equals": "fail",
          "field": "$.driver.resolutionType",
          "kind": "resultField"
        }
      ],
      "checkId": "driver-api-ext.resume.missing-pending-call-resolution-fail",
      "input": {
        "scenarioPath": "$.driver-resume-missing-pending-call"
      },
      "operation": "driver.resume",
      "scenario": "driver-api-scenarios",
      "evidence": ["result.driver.resolutionType"]
    },
    {
      "assertions": [
        {
          "kind": "errorEnvelope",
          "path": "$.result.error"
        }
      ],
      "checkId": "driver-api-ext.resume.missing-pending-call-error-envelope",
      "evidence": ["result.error.code"],
      "input": {
        "scenarioPath": "$.driver-resume-missing-pending-call"
      },
      "operation": "driver.resume",
      "scenario": "driver-api-scenarios"
    }
  ],
  "packetId": "tuvren.framework.driver-api",
  "planId": "tuvren.framework.driver-api.extended",
  "planVersion": "0.1.0",
  "scenarios": {
    "driver-api-scenarios": "../scenarios/driver-api-scenarios.json"
  }
}
